{
  "schema_version": "v1",
  "category": "grpc_client",
  "technology": "grpc_go",
  "version_pin": "google.golang.org-grpc==1.62.0",
  "language": "go",
  "install": {"manager": "go", "package": "google.golang.org/grpc@v1.62.0"},
  "imports": {
    "primary": "\"google.golang.org/grpc\"",
    "types": ["\"context\"", "\"google.golang.org/grpc/credentials/insecure\""]
  },
  "client_construction": {
    "code": "conn, err := grpc.Dial(target, grpc.WithTransportCredentials(insecure.NewCredentials())); if err != nil { return nil, err }; client := NewServiceClient(conn)",
    "is_async": false,
    "thread_safe": true,
    "dependencies": ["target"]
  },
  "primary_operations": [
    {
      "name": "Call",
      "signature": "(req []byte) ([]byte, error)",
      "sdk_call": "resp, err := c.client.Call(context.Background(), &Request{Payload: req}); if err != nil { return nil, err }; return resp.Payload, nil",
      "error_types": ["*status.Status", "*grpc.ClientConnClosingError"],
      "idempotency": "idempotent",
      "retry_policy": "exponential_backoff(max=3)"
    }
  ],
  "auth": {"method": "none"},
  "code_style_notes": [
    "grpc.Dial is non-blocking; use grpc.WithBlock() to wait for connection",
    "Use protoc-gen-go to generate the *Client stub from .proto"
  ],
  "allowed_doc_origins": ["https://pkg.go.dev/google.golang.org/grpc"]
}
