{
  "schema_version": "v1",
  "category": "grpc_server_handler",
  "technology": "connect_go",
  "version_pin": "connect-go==1.16.0",
  "language": "go",
  "install": {"manager": "go", "package": "connectrpc.com/connect@v1.16.0"},
  "imports": {
    "primary": "\"connectrpc.com/connect\"",
    "types": ["\"context\""]
  },
  "client_construction": {
    "code": "_ = connect.WithCompressMinBytes(1024)",
    "is_async": false,
    "thread_safe": true,
    "dependencies": []
  },
  "primary_operations": [
    {
      "name": "Call",
      "signature": "(ctx context.Context, req *connect.Request[Request]) (*connect.Response[Response], error)",
      "sdk_call": "out, err := h.useCase.Execute(req.Msg.Payload); if err != nil { return nil, err }; return connect.NewResponse(&Response{Payload: out}), nil",
      "error_types": ["*connect.Error"],
      "idempotency": "idempotent",
      "retry_policy": "none"
    }
  ],
  "auth": {"method": "none"},
  "code_style_notes": [
    "connect-go handler signatures use generic *connect.Request[T] / *connect.Response[T] wrappers",
    "Register via NewServiceHandler(handler) which returns an http.Handler"
  ],
  "allowed_doc_origins": ["https://connectrpc.com/docs/go/"]
}
